[
  {
    "id": "01_cpp/01_base",
    "title": "01_Основы",
    "section": "01_cpp",
    "path": "content/01_cpp/01_base.md",
    "question_count": 0,
    "headings": [
      "01_Основы",
      "Лёгкий уровень",
      "Средний уровень"
    ],
    "links": [
      "./02_types.md"
    ]
  },
  {
    "id": "01_cpp/02_types",
    "title": "02_Типы",
    "section": "01_cpp",
    "path": "content/01_cpp/02_types.md",
    "question_count": 0,
    "headings": [
      "02_Типы",
      "Лёгкий уровень",
      "Средний уровень",
      "Сложный уровень"
    ],
    "links": [
      "./01_base.md",
      "./03_pointers.md"
    ]
  },
  {
    "id": "01_cpp/03_pointers",
    "title": "Указатели_и_ссылки",
    "section": "01_cpp",
    "path": "content/01_cpp/03_pointers.md",
    "question_count": 0,
    "headings": [
      "Указатели_и_ссылки",
      "Лёгкий уровень",
      "Ниже среднего уровня",
      "Средний уровень",
      "Сложный уровень"
    ],
    "links": [
      "./02_types.md",
      "./04_memory.md"
    ]
  },
  {
    "id": "01_cpp/04_memory",
    "title": "Память_и_lifetime",
    "section": "01_cpp",
    "path": "content/01_cpp/04_memory.md",
    "question_count": 0,
    "headings": [
      "Память_и_lifetime",
      "Лёгкий уровень",
      "Ниже среднего уровня",
      "Средний уровень",
      "Сложный уровень",
      "Очень сложный уровень"
    ],
    "links": [
      "./03_pointers.md",
      "./05_function.md"
    ]
  },
  {
    "id": "01_cpp/05_function",
    "title": "Функции",
    "section": "01_cpp",
    "path": "content/01_cpp/05_function.md",
    "question_count": 0,
    "headings": [
      "Функции",
      "Лёгкий уровень",
      "Ниже среднего уровня",
      "Средний уровень",
      "Выше среднего уровня",
      "Сложный уровень",
      "Очень сложный уровень / с уклоном в функциональное программирование"
    ],
    "links": [
      "./04_memory.md",
      "./06_oop.md"
    ]
  },
  {
    "id": "01_cpp/06_oop",
    "title": "ООП",
    "section": "01_cpp",
    "path": "content/01_cpp/06_oop.md",
    "question_count": 0,
    "headings": [
      "ООП",
      "Лёгкий уровень",
      "Ниже среднего уровня",
      "Средний уровень",
      "Выше среднего уровня",
      "Сложный уровень",
      "Очень сложный уровень / дизайн и архитектура"
    ],
    "links": [
      "./05_function.md",
      "./07_templates.md"
    ]
  },
  {
    "id": "01_cpp/07_templates",
    "title": "Шаблоны_и_метапрограммирование",
    "section": "01_cpp",
    "path": "content/01_cpp/07_templates.md",
    "question_count": 0,
    "headings": [
      "Шаблоны_и_метапрограммирование",
      "Лёгкий уровень",
      "Ниже среднего уровня",
      "Средний уровень",
      "Выше среднего уровня",
      "Сложный уровень",
      "Очень сложный уровень",
      "Экспертный уровень / метапрограммирование и дизайн"
    ],
    "links": [
      "./06_oop.md",
      "./08_stl.md"
    ]
  },
  {
    "id": "01_cpp/08_stl",
    "title": "STL",
    "section": "01_cpp",
    "path": "content/01_cpp/08_stl.md",
    "question_count": 0,
    "headings": [
      "STL",
      "Лёгкий уровень",
      "Ниже среднего уровня",
      "Средний уровень",
      "Выше среднего уровня",
      "Сложный уровень",
      "Очень сложный уровень / дизайн и практика"
    ],
    "links": [
      "./07_templates.md",
      "./09_modern_cpp.md"
    ]
  },
  {
    "id": "01_cpp/09_modern_cpp",
    "title": "Modern_C++",
    "section": "01_cpp",
    "path": "content/01_cpp/09_modern_cpp.md",
    "question_count": 0,
    "headings": [
      "Modern_C++",
      "Лёгкий уровень",
      "Ниже среднего уровня",
      "Средний уровень",
      "Выше среднего уровня",
      "Сложный уровень"
    ],
    "links": [
      "./08_stl.md",
      "./10_raii_move_semantics.md"
    ]
  },
  {
    "id": "01_cpp/10_raii_move_semantics",
    "title": "RAII_move_semantics",
    "section": "01_cpp",
    "path": "content/01_cpp/10_raii_move_semantics.md",
    "question_count": 0,
    "headings": [
      "RAII_move_semantics",
      "Лёгкий уровень",
      "Ниже среднего уровня",
      "Средний уровень",
      "Сложный уровень"
    ],
    "links": [
      "./09_modern_cpp.md",
      "./11_exceptions.md"
    ]
  },
  {
    "id": "01_cpp/11_exceptions",
    "title": "Exceptions",
    "section": "01_cpp",
    "path": "content/01_cpp/11_exceptions.md",
    "question_count": 0,
    "headings": [
      "Exceptions",
      "Лёгкий уровень",
      "Ниже среднего уровня",
      "Средний уровень",
      "Выше среднего уровня",
      "Сложный уровень"
    ],
    "links": [
      "./10_raii_move_semantics.md",
      "./12_compile_time.md"
    ]
  },
  {
    "id": "01_cpp/12_compile_time",
    "title": "Compile_time",
    "section": "01_cpp",
    "path": "content/01_cpp/12_compile_time.md",
    "question_count": 0,
    "headings": [
      "Compile_time",
      "Лёгкий уровень",
      "Ниже среднего уровня",
      "Средний уровень",
      "Выше среднего уровня",
      "Сложный уровень",
      "Очень сложный уровень"
    ],
    "links": [
      "./11_exceptions.md",
      "./13_low_level.md"
    ]
  },
  {
    "id": "01_cpp/13_low_level",
    "title": "Low_level",
    "section": "01_cpp",
    "path": "content/01_cpp/13_low_level.md",
    "question_count": 0,
    "headings": [
      "Low_level",
      "Лёгкий уровень",
      "Ниже среднего уровня",
      "Средний уровень",
      "Выше среднего уровня",
      "Сложный уровень"
    ],
    "links": [
      "./12_compile_time.md",
      "./14_macro_and_build.md"
    ]
  },
  {
    "id": "01_cpp/14_macro_and_build",
    "title": "Препроцессор_и_сборка",
    "section": "01_cpp",
    "path": "content/01_cpp/14_macro_and_build.md",
    "question_count": 0,
    "headings": [
      "Препроцессор_и_сборка",
      "Лёгкий уровень",
      "Ниже среднего уровня",
      "Средний уровень",
      "Выше среднего уровня",
      "Сложный уровень"
    ],
    "links": [
      "./13_low_level.md",
      "./15_performance.md",
      "README.md"
    ]
  },
  {
    "id": "01_cpp/15_performance",
    "title": "Performance",
    "section": "01_cpp",
    "path": "content/01_cpp/15_performance.md",
    "question_count": 0,
    "headings": [
      "Performance",
      "Лёгкий уровень",
      "Ниже среднего уровня",
      "Средний уровень",
      "Выше среднего уровня",
      "Сложный уровень"
    ],
    "links": [
      "./14_macro_and_build.md",
      "./16_best_practices.md"
    ]
  },
  {
    "id": "01_cpp/16_best_practices",
    "title": "Best_practices",
    "section": "01_cpp",
    "path": "content/01_cpp/16_best_practices.md",
    "question_count": 0,
    "headings": [
      "Best_practices",
      "Лёгкий уровень",
      "Ниже среднего уровня",
      "Средний уровень",
      "Выше среднего уровня"
    ],
    "links": [
      "./15_macro_and_build.md",
      "README.md"
    ]
  },
  {
    "id": "01_cpp/README",
    "title": "C++",
    "section": "01_cpp",
    "path": "content/01_cpp/README.md",
    "question_count": 0,
    "headings": [
      "C++"
    ],
    "links": [
      "./01_base.md",
      "./02_types.md",
      "./03_pointers.md",
      "./04_memory.md",
      "./05_function.md",
      "./06_oop.md",
      "./07_templates.md",
      "./08_stl.md",
      "./09_modern_cpp.md",
      "./10_raii_move_semantics.md",
      "./11_exceptions.md",
      "./12_compile_time.md",
      "./13_low_level.md",
      "./14_macro_and_build.md",
      "./15_performance.md",
      "./16_best_practices.md",
      "./02_types.md"
    ]
  },
  {
    "id": "02_algorithms_and_ds/README",
    "title": "Блоки по:",
    "section": "02_algorithms_and_ds",
    "path": "content/02_algorithms_and_ds/README.md",
    "question_count": 0,
    "headings": [
      "Блоки по:",
      "Сборник вопросов по алгоритмам и структурам данных (C++-ориентированный)",
      "1. Базовая асимптотика и анализ",
      "2. Массивы и префиксные техники",
      "3. Строки",
      "4. Связные списки",
      "5. Stack / Queue / Deque",
      "6. Хеш-таблицы и множества",
      "7. Двоичный поиск и поиск по ответу",
      "8. Сортировки",
      "9. Деревья: основы",
      "10. BST / Heap / Priority Queue",
      "11. Графы: базовые обходы",
      "12. Графы: кратчайшие пути и MST",
      "13. DSU / Union-Find",
      "14. Рекурсия, backtracking, brute force",
      "15. Dynamic Programming: базовый уровень",
      "16. Dynamic Programming: продвинутый уровень",
      "17. Greedy",
      "18. Bit manipulation",
      "19. Интервалы, sweep line, события",
      "20. Fenwick / Segment Tree / Sparse Table",
      "21. Trie / String DS",
      "22. Математика и теория чисел",
      "23. Геометрия и вычислительная геометрия",
      "24. C++ STL и практические аспекты"
    ],
    "links": []
  },
  {
    "id": "03_concurrency/01_base",
    "title": "01_base",
    "section": "03_concurrency",
    "path": "content/03_concurrency/01_base.md",
    "question_count": 0,
    "headings": [
      "1. Основы",
      "2. Модель памяти",
      "3. `std::thread`, `std::jthread`",
      "4. Передача данных между потоками",
      "5. Mutex и RAII",
      "6. Deadlock и стратегии захвата",
      "7. Condition variable, semaphore, ожидание",
      "8. Современные примитивы C++20+",
      "9. Atomics и lock-free"
    ],
    "links": [
      "./02_review_code.md"
    ]
  },
  {
    "id": "03_concurrency/02_review_code",
    "title": "1. Memory model и базовая корректность",
    "section": "03_concurrency",
    "path": "content/03_concurrency/02_review_code.md",
    "question_count": 0,
    "headings": [
      "1. Memory model и базовая корректность",
      "2. Жизненный цикл потоков и lifetime",
      "3. Mutex, lock discipline и deadlock",
      "4. Condition variable и wait/notify протоколы",
      "5. Atomics и CAS",
      "6. Thread-safe структуры и API design",
      "7. Thread pools, tasks и execution",
      "8. `std::async`, futures, coroutines",
      "9. Типичные мини-задачи, которые любят на senior interview",